{
  "version": "1",
  "generated_at": "2026-05-21T20:21:24Z",
  "repo_url": "https://github.com/StuKozola/agent-resource-catalog",
  "plugins": [
    {
      "name": "product-manager",
      "path": "plugins/product-manager",
      "version": "1.0.0",
      "description": "Comprehensive skills for product managers — Pragmatic Framework execution (PRDs, roadmaps, personas, positioning, pricing, launch) combined with Seven Powers competitive strategy (moats, counter-positioning, network effects, process power, branding).",
      "skills": [
        "branding",
        "buyer-experience",
        "buyer-personas",
        "competitive-landscape",
        "cornered-resource",
        "counter-positioning",
        "distinctive-competencies",
        "market-problems",
        "network-economies",
        "pragmatic-innovation",
        "pragmatic-launch",
        "pragmatic-market-definition",
        "pragmatic-positioning",
        "pragmatic-pricing",
        "pragmatic-requirements",
        "pragmatic-stakehloder-communications",
        "pragmatic-use-scenarios",
        "pragmatic-user-personas",
        "process-power",
        "product-roadmap",
        "scale-economies",
        "switching-costs",
        "win-loss-analysis"
      ],
      "commands": [],
      "connectors": [
        "design",
        "knowledge-base",
        "messaging",
        "project-tracker",
        "research"
      ],
      "raw_url_prefix": "https://raw.githubusercontent.com/StuKozola/agent-resource-catalog/main/plugins/product-manager"
    },
    {
      "name": "product-marketing",
      "path": "plugins/product-marketing",
      "version": "1.0.0",
      "description": "Comprehensive skills for product marketers — Pragmatic Framework go-to-market execution (positioning, launch, content, channels, sales tools, measurement) combined with Seven Powers competitive strategy (moats, counter-positioning, network effects, process power, branding).",
      "skills": [
        "advocacy",
        "awareness",
        "branding",
        "buyer-experience",
        "buyer-personas",
        "channel-training",
        "channels",
        "competitive-landscape",
        "content",
        "cornered-resource",
        "counter-positioning",
        "distribution-strategy",
        "events",
        "marketing-plan",
        "measurement",
        "network-economies",
        "nurturing",
        "pragmatic-launch",
        "pragmatic-positioning",
        "process-power",
        "programs",
        "sales-alignment",
        "sales-tools",
        "scale-economies",
        "switching-costs",
        "win-loss-analysis"
      ],
      "commands": [],
      "connectors": [
        "analytics",
        "crm",
        "knowledge-base",
        "messaging",
        "research"
      ],
      "raw_url_prefix": "https://raw.githubusercontent.com/StuKozola/agent-resource-catalog/main/plugins/product-marketing"
    }
  ],
  "standalone": []
}
